{
  "$schema": "https://json-schema.org/draft/2020-12/schema",
  "$id": "https://rota-saude/schemas/clinical/consultation-addendum-v1.json",
  "title": "rotasaude.consultation_addendum.v1",
  "description": "JSON canônico do adendo (ADR 0032; módulo 19b), assinado pelo autor do adendo em CAdES destacado AD-RB, serializado em RFC 8785 (JCS). previous_sha256 encadeia o adendo ao documento anterior da mesma consulta. $defs idêntico ao de consultation-v1.json. Fechado (additionalProperties: false).",
  "type": "object",
  "additionalProperties": false,
  "required": ["schema", "city", "unit", "professional", "patient", "addendum"],
  "properties": {
    "schema": { "const": "rotasaude.consultation_addendum.v1" },
    "city": { "$ref": "#/$defs/city" },
    "unit": { "$ref": "#/$defs/unit" },
    "professional": { "$ref": "#/$defs/professional" },
    "patient": { "$ref": "#/$defs/patient" },
    "addendum": {
      "type": "object",
      "additionalProperties": false,
      "required": ["consultation_id", "id", "created_at", "reason", "text", "changes", "previous_sha256"],
      "properties": {
        "consultation_id": { "$ref": "#/$defs/uuid" },
        "id": { "$ref": "#/$defs/uuid" },
        "created_at": { "$ref": "#/$defs/utc_datetime" },
        "reason": { "type": "string", "minLength": 10, "maxLength": 500 },
        "text": { "type": "string", "minLength": 1, "maxLength": 20000 },
        "changes": {
          "type": "object",
          "additionalProperties": false,
          "description": "Contrato do 19a §9. Chave ausente = sem mudança. evaluated_problems = só os eventos novos. conducts = sempre a lista final, não vazia, quando mudou. exam_requests = a lista final quando mudou; [] significa que todos os exames foram cancelados (lista final vazia). Objeto vazio quando o adendo é só texto.",
          "properties": {
            "evaluated_problems": { "type": "array", "minItems": 1, "maxItems": 50, "items": { "$ref": "#/$defs/evaluated_problem" } },
            "conducts": { "$ref": "#/$defs/conducts" },
            "exam_requests": { "$ref": "#/$defs/exam_requests" }
          }
        },
        "previous_sha256": { "type": "string", "pattern": "^[0-9a-f]{64}$", "description": "canonical_sha256 do documento assinado anterior da mesma consulta (consulta ou adendo); sem nenhum assinado ainda, o SHA-256 do JCS da consulta como montado no momento em que o adendo é assinado, que não precisa coincidir com uma assinatura posterior da consulta." }
      }
    }
  },
  "$defs": {
    "uuid": { "type": "string", "pattern": "^[0-9a-f]{8}-[0-9a-f]{4}-[0-9a-f]{4}-[0-9a-f]{4}-[0-9a-f]{12}$" },
    "utc_datetime": { "type": "string", "pattern": "^[0-9]{4}-[0-9]{2}-[0-9]{2}T[0-9]{2}:[0-9]{2}:[0-9]{2}Z$", "description": "ISO 8601 em UTC, com segundos, sem fração, com 'Z'." },
    "date": { "type": "string", "pattern": "^[0-9]{4}-[0-9]{2}-[0-9]{2}$" },
    "cpf": { "type": "string", "pattern": "^[0-9]{11}$", "description": "Só dígitos, sem máscara." },
    "clinical_text": { "type": ["string", "null"], "minLength": 1, "maxLength": 20000, "description": "null quando o campo ficou vazio; nunca string vazia." },
    "city": {
      "type": "object",
      "additionalProperties": false,
      "required": ["ibge_code", "name"],
      "properties": {
        "ibge_code": { "type": ["string", "null"], "pattern": "^[0-9]{7}$" },
        "name": { "type": "string", "minLength": 1 }
      }
    },
    "unit": {
      "type": "object",
      "additionalProperties": false,
      "required": ["cnes", "name"],
      "properties": {
        "cnes": { "type": ["string", "null"], "pattern": "^[0-9]{7}$" },
        "name": { "type": "string", "minLength": 1 }
      }
    },
    "professional": {
      "type": "object",
      "additionalProperties": false,
      "required": ["name", "cpf", "cbo_code", "council"],
      "properties": {
        "name": { "type": "string", "minLength": 1 },
        "cpf": { "$ref": "#/$defs/cpf" },
        "cbo_code": { "type": "string", "pattern": "^[0-9]{6}$" },
        "council": {
          "type": "object",
          "additionalProperties": false,
          "required": ["name", "state", "registration_number"],
          "properties": {
            "name": { "enum": ["CRM", "COREN", "CRO", "CRF", "CRP", "CREFITO", "CRN", "CRFa", "CRESS", "CRBM", "CREF", "CRMV"] },
            "state": { "type": "string", "pattern": "^[A-Z]{2}$" },
            "registration_number": { "type": "string", "pattern": "^[0-9]{1,10}$" }
          }
        }
      }
    },
    "patient": {
      "type": "object",
      "additionalProperties": false,
      "required": ["display_name", "cpf", "birth_date"],
      "properties": {
        "display_name": { "type": "string", "minLength": 1, "maxLength": 200 },
        "cpf": { "$ref": "#/$defs/cpf" },
        "birth_date": { "anyOf": [{ "$ref": "#/$defs/date" }, { "type": "null" }] }
      }
    },
    "vitals": {
      "type": "object",
      "additionalProperties": false,
      "description": "Só as medidas preenchidas; objeto vazio quando nenhuma. Plausibilidade é regra do api.",
      "properties": {
        "systolic": { "type": "integer" },
        "diastolic": { "type": "integer" },
        "heart_rate": { "type": "integer" },
        "respiratory_rate": { "type": "integer" },
        "temperature_c": { "type": "number" },
        "spo2": { "type": "integer" },
        "capillary_glucose": { "type": "integer" },
        "glucose_moment": { "enum": ["fasting", "postprandial", "random"] },
        "weight_kg": { "type": "number" },
        "height_cm": { "type": "integer" },
        "bmi": { "type": "number" },
        "pain_score": { "type": "integer", "minimum": 0, "maximum": 10 }
      }
    },
    "evaluated_problem": {
      "type": "object",
      "additionalProperties": false,
      "required": ["terminology", "code", "label", "release", "action"],
      "properties": {
        "terminology": { "enum": ["ciap2", "cid10"] },
        "code": { "type": "string", "minLength": 1, "maxLength": 8 },
        "label": { "type": "string", "minLength": 1 },
        "release": { "type": "string", "minLength": 1, "description": "Versão da tabela (TerminologyRelease#version) vigente no ato." },
        "action": { "enum": ["evaluate", "add", "resolve", "correct_onset"] },
        "onset_on": { "$ref": "#/$defs/date" },
        "onset_precision": { "enum": ["day", "month", "year"] }
      }
    },
    "conducts": {
      "type": "array",
      "minItems": 1,
      "maxItems": 12,
      "uniqueItems": true,
      "items": { "enum": [1, 2, 4, 5, 6, 7, 8, 9, 10, 11, 12, 14] }
    },
    "exam_requests": {
      "type": "array",
      "maxItems": 100,
      "items": {
        "type": "object",
        "additionalProperties": false,
        "required": ["sigtap_code", "competence", "label"],
        "properties": {
          "sigtap_code": { "type": "string", "pattern": "^02[0-9]{8}$" },
          "competence": { "type": "string", "pattern": "^[0-9]{4}(0[1-9]|1[0-2])$", "description": "Competência SIGTAP (AAAAMM) da tabela de onde saiu o rótulo, vigente no ato." },
          "label": { "type": "string", "minLength": 1 },
          "cid10_justification": { "type": "string", "minLength": 1, "maxLength": 8 }
        }
      }
    },
    "outcome": {
      "type": "object",
      "additionalProperties": false,
      "required": ["code"],
      "properties": {
        "code": { "enum": ["discharged", "referred", "return"] },
        "referral_unit_cnes": { "type": "string", "pattern": "^[0-9]{7}$" },
        "referral_note": { "type": "string", "minLength": 1 }
      }
    }
  }
}
