{
  "schema": "rotasaude.consultation_addendum.v1",
  "city": {
    "ibge_code": "4106902",
    "name": "Curitiba"
  },
  "unit": {
    "cnes": "0015466",
    "name": "UBS Ouvidor Pardinho"
  },
  "professional": {
    "name": "Carla Mendes",
    "cpf": "16899535009",
    "cbo_code": "223565",
    "council": {
      "name": "COREN",
      "state": "PR",
      "registration_number": "123456"
    }
  },
  "patient": {
    "display_name": "Joana D'Arc Conceição 👩🏽‍⚕️",
    "cpf": "39053344705",
    "birth_date": "1961-03-14"
  },
  "addendum": {
    "consultation_id": "0b6f3c1e-8a2d-4c47-9f1e-2d3a4b5c6d7e",
    "id": "5e1d2c3b-4a59-4687-b7c8-d9e0f1a2b3c4",
    "created_at": "2026-10-09T09:02:11Z",
    "reason": "Resultado de exame chegou depois da consulta.",
    "text": "HbA1c 9,2%. Mantida a conduta.",
    "changes": {
      "evaluated_problems": [
        {
          "terminology": "ciap2",
          "code": "T90",
          "label": "Diabetes não insulino-dependente",
          "release": "2",
          "action": "correct_onset",
          "onset_on": "2018-06-01",
          "onset_precision": "month"
        }
      ],
      "conducts": [
        1,
        9,
        12
      ],
      "exam_requests": [
        {
          "sigtap_code": "0202010503",
          "competence": "202609",
          "label": "Dosagem de hemoglobina glicosilada"
        }
      ]
    },
    "previous_sha256": "9f2c4b7e1d0a8c6f3e5b2a1d4c7f0e9b8a6d3c2f1e0b9a8d7c6f5e4d3c2b1a09"
  }
}
